<?xml version="1.0" encoding="UTF-8"?>
<Interesovanje xmlns="http://www.vakc-sistem.rs/interesovanje"
    xmlns:xsi="http://www.w3.org/2001/XMLSchema-instance"
    xsi:schemaLocation="http://www.vakc-sistem.rs/interesovanje interesovanje.xsd"
    Id="123123">
    <Drzavljanstvo>
        <Domace_drzavljanstvo>
            <JMBG>0101999103012</JMBG>
        </Domace_drzavljanstvo>
    </Drzavljanstvo>
    <Ime>Marko</Ime>
    <Prezime>MarkoviÄ‡</Prezime>
    <Kontakt>
        <Broj_telefona>062123456</Broj_telefona>
        <Broj_fiksnosg_telefona>695421412</Broj_fiksnosg_telefona>
        <Email_adresa>markomarkovic@gmail.com</Email_adresa>
    </Kontakt>
    <Opstina_vakcinisanja>Novi Sad</Opstina_vakcinisanja>
    <Vrsta_vakcine>
        <Vakcina Tip="Pfizer"/>
        <Vakcina Tip="Sinopharm"/>
    </Vrsta_vakcine>
    <Dobrovoljni_davalac>Da</Dobrovoljni_davalac>
    <Datum>2021-12-05</Datum>
</Interesovanje>